salary,company,jobcont,jobname
10000-15000/月,广州市咕吱网络科技有限公司,"岗位职责：1. 负责配置直播平台(linux)运行环境，产品及网站的运维工作；2. 负责云服务器，云存储，CDN的前期规划、监控，数据备份，日志分析，故障排除，性能调优等工作；3. 研究运维相关技术，根据系统需求制定运维技术方案；4. 研究系统架构、提高系统的健康性，参与运维流程制定、保证高效响应；5、相关故障处理，异常事件的协调处理与报告。任职要求：1、大专及以上学历，计算机相关专业,5年以上相关经验；2、熟悉Linux下Nginx+MySQL+PHP的配置、使用、维护，熟悉云服务器集群，CDN工作原理及云存储规划；3、了解Shell编程、熟悉Perl、Python等脚本语言尤佳；4、有较强的学习能力，热爱系统管理工作，有高度的责任心，喜欢钻研系统管理相关技术；5、对系统安全，入侵检测等有一定了解，能根据服务器的情况制定相应安全措施。",资深运维工程师
6500-15000/月,广州健迅科技有限公司,中级JAVA开发工程师岗位职责：1、参与软件的设计、开发、测试、修改bug等工作，包括业务需求的沟通，功能模块详细设计，业务功能实现与单元测试，系统维护；2、参与产品构思和架构设计；3、撰写相关的技术文档；4、对各种主流设计模式熟悉并能根据实际情况优化；5、支持项目对产品的完善。任职要求：1、精通Java，熟练掌握Java网络编程；2、熟练运用开源软件包；3、熟悉互联网开发模式，了解集群、负载均衡的配置；4、熟悉mysql，有用Java做大访问量高压力网络应用的经验；5、熟悉Linux/Nginx，熟练配置维护Tomcat，Resin等应用服务器，掌握shell/awk/python等系统脚本工具；6、熟悉领域模型，根据业务模型进行数据库设计，并熟练掌握SQL语句，熟练使用数据库；7、熟悉HTML5/JAVASCRIPT/CSS/Ajax 等页面技术；8、熟练使用Eclipse/Maven/SVN/GIT等软件开发工具。福利待遇：1、五天八小时工作制，提供早、午、晚工作餐，社保、年假、法定假期、体检、等福利齐全；2、提供岗位职业培训，有完善的考核、奖励、晋升机制，为员工提供广阔的个人发展空间。地址：广州市中山二路35号8楼（省冶金设计院大厦东门）邮箱：hr@jetsun.com.cn官网：www.jianxun.com.cn官网：www.pku-hit.com,中级JAVA
15000-19999/月,广州合摩计算机科技有限公司,岗位职责：1、参与商业化后台系统、子系统和模块级的的需求分析、架构设计、概要设计工作，承担核心功能代码编写，开发与维护系统公用核心模块；2、系统性能优化，主导技术难题攻关，持续提升系统在大规模分布式系统环境下高并发、海量请求数下的高处理性能，解决各类潜在系统技术风险，保证系统的安全、稳定、快速运行；3、参与平台相关基础设施建设与系统级重构的开发及技术研究；4、对商业化的海量服务实施对应的解决方案，能够根据不同的业务需求，灵活快速地完成具有挑战性的项目。5、参与系统文档、研究报告、开发规范的撰写、维护。6、参与或协助跨团队项目研发，并推动团队内成员技术经验分享。任职要求：1.要求3-5年以上JEE开发经验，3年以上的Java B/S架构开发经验，可以独立完成子系统/模块的需求分析，独立设计和编码；2. 扎实的Java编程基础，熟悉Java开发环境、工具和各种设计模式，对Java面向对象软件结构有深入理解以及很强的应用能力；3. 熟练掌握Spring/Struts/ hibernate/Ibatis或其他主流JAVA框架，熟悉分布式事务管理，分布式文件，缓存，消息中间件等核心技术；4. 熟悉MySQL/PostgreSQL数据库中的一种或多种，有数据库调优经验，具备数据库应用系统的规划及设计能力；5. 熟悉整个软件过程，能够沟通需求、控制项目进度，有良好的文档能力；6. 要求有良好的组件级建模能力，熟悉NoSQL、MQ、Cache、TCP/IP原理，掌握多线程及高性能的设计与编码及性能调优，能够设计复杂业务、高并发、大数据量的系统；7、熟练掌握memcache、redis等缓存技术；8、熟悉Linux/Unix系统，包括Shell/Python等脚本编码和软件开发等；9、精通Java及Web的开发和应用，熟悉HTML和JSP，对CSS、jvm、Servlet、JavaScript有一定了解，熟悉Nginx/Tomcat/JBoss等服务器，有大规模高并发访问的Web应用系统设计和开发经验者优先；10、热爱软件研发工作，有强烈的创新精神并能付诸实施，能积极学习业界新技术，追求编写优雅的代码，从技术趋势和思路上能影响技术团队。11、有金融支付系统或互联网支付开发经验者优先，有bat等大型互联网公司从业经验尤佳；12、具备良好的分析解决问题能力，能独立承担任务，有系统进度把控能力；13、责任心强、工作认真，细心，有条理；积极性高，求知欲强；具有良好的沟通能力及团队合作精神。对系统质量有近乎苛刻的要求意识；计算机相关专业本科及以上学历。如果以上不完全符合，也没关系，只要你确认自己是个技术人才，对技术有足够的热情，希望找到一个能发挥你能力的地方，也欢迎投递简历。,高级Java开发工程师
,阿里巴巴集团,1、以线上业务的高可用性为目标，负责业务系统的运维架构设计，并持续进行优化；2、主导系统技术研究和应用，如操作系统标准化、定制化，系统优化、手机无线网络研究等，并推动适合的技术应用于生产；3、主导解决运维工作中重大故障，性能瓶颈等相关疑难问题；4、配合优化运维规范、工作流程、应急预案等。1、计算机或相关专业本科以上学历；2、知名互联网企业五年以上系统管理经验，或从事系统架构师/资深系统工程师三年以上；具有移动互联网企业经验优先；3、具有大规模运维的经验，精于容量规划、架构设计、性能优化；4、深入理解linux系统，tcp/ip以及具有丰富的广域网、局域网网络络知识，有丰富的大型网站运维(nginx/apache/squid/http协议)经验，熟练使用shell、perl、python等脚本编程语言；5、具有很强的故障排查能力，重视流程规范，有很好的技术敏感度；6、拥有良好的项目管理能力和流程管理能力，敏锐的风险意识和良好的风险识别能力；7、具备较强的沟通能力与推动能力，能够带领工程师完成复杂项目,阿里移动-高级系统运维工程师
10000-14999/月,完美世界（北京）总部/完美时空,岗位职责：1. 负责游戏服务器的规划部署，对服务器构架和网络进行优化和改进；2. 负责突发性事件的快速响应和处理，解决服务器和网络故障；3. 负责游戏日常技术运营维护．事务处理；4. 负责游戏相关数据的分析和总结；5. 配合策划以及研发人员沟通，解决相关游戏问题。岗位要求：1. 理工类或计算机相关专业本科及以上学历，具有3年以上游戏运维相关工作经验优先，具有网络安全方面的运维能力；2. 人品正直，工作态度认真负责，能吃苦耐劳，注重团队合作；3. 熟练掌握Linux和Windows操作和维护，linux运维方面见长者，较强的反黑客程序能力者；4. 熟练配置Apache/Nginx/PHP/MySQL/Puppe/zabbixt等开源软件；5. 熟练编写shell，熟悉Perl、Python、PHP任其一种语言优先；6. 熟悉TCP/IP协议及常用网络应用；7. 熟悉网络架构，具备基本的网络故障排错能力，对网络安全有一定的了解；8. 掌握MySQL语法及操作。,网络运维开发
4500-5999/月,广东梦享家生物科技有限公司,岗位职责：1.	负责网络基础设施的管理。a.	负责电脑、服务器、交换机、考勤机、网线、电话等网络设备的管理维护；b.	负责公司投影仪、复印机、传真机、扫描仪等电脑周边设备的管理维护；c.	对公司网络及服务器的问题进行解决、优化公司网络、解决故障、维护网络系统的正常运行2.	 负责操作系统和应用系统的管理3.	负责网络资源使用权限管理。4.	负责系统运营工作（运维、管理，部署和容量规划不断的提出优化建设）5.	负责各类运维管理平台和工具的开发和维护工作，并不断优化工具效率。任职要求：1.	计算机相关专业大专以上学历，两年相关工作经验；2.	熟练配置Linux、Apache、Tomat、Nginx、LVS、Keepalived、fastDFS、redis、memcache、mongodb等常用服务的安装、配置、维护及优化。3.	能熟练运用Shell、Python、pupet来实现自动化运维工作。4.	熟悉Linux下MySQL高可用及主从同步的部署和维护。5.	能够熟练排查运维过程中出现的服务故障、系统故障、网络故障。6.	熟悉主流虚拟化及云计算平台的搭建及维护，如openstack/rhev/docker。7.	精通路由器，交换机，防火墙等网络及安全设备的工作原理和特性，并能熟练配置。,运维工程师
10000-14999/月,广州深海软件股份有限公司,岗位职责：1. 负责配置游戏运行环境，游戏及网站的运维工作；2. 游戏服务器的规划、监控，数据备份，日志分析，故障排除，性能调优等工作；3. 研究运维相关技术，根据系统需求制定运维技术方案；4. 研究系统架构、提高系统的健康性，参与运维流程制定、保证高效响应。任职要求：1. 大专及以上学历，计算机相关专业；2. 熟悉Linux操作系统的维护；3. 熟悉Nginx+MySQL+PHP的配置、使用；4. 了解Shell编程、熟悉Perl、Python等脚本语言尤佳；5. 有较强的学习能力，热爱系统管理工作，有高度的责任心，喜欢钻研系统管理相关技术6. 对系统安全，入侵检测等有一定了解，能根据服务器的情况制定相应安全措施；7. 具有游戏运维经验、大型网站运维经验者优先。,运维工程师
6000-7999/月,广东医群科技有限公司,1、岗位职责：2、负责后台系统Mysql/nginx安装配置3、负责公司网络管理，维护与组建4、负责公司服务器安全管理与日常维护5、负责一些其他监控脚本编写任职资格：1.计算机相关专业、本科以上学历、1年以上经验2.熟悉Linux shell 常用命令与网络配置3.具有安装配置Mysql redis nginx 应用服务能力4.熟悉局域网搭建，路由器配置，Centos， windows系统安装5.熟悉通用服务器Raid卡配置6.熟悉LVS keepalive 配置7.熟悉Shell， Python， Lua 脚本语言其中二者以上8.具有强烈的责任心和工作主动性9.具有一定的英语读写能力 CET4 以上名医传世是医院培训整体解决方案的提供商，解决医院培训的不规范、零乱不系统、重复性培训等问题，还解决严重存在医护人员技能提升培训渠道不通畅、成本高等问题。名医传世提供SaaS培训考核管理系统，帮助让医院建立各岗位培训体系，让所有的岗位培训，变成标准化、信息化、程序化和系统性；并能建立每个职员的培训历程、档案，方便管理者人才培训分析、调整培训方案，建立精准培训等，全方位帮助医院打造强大的医疗团队。名医传世平台的功能主要有：1、能快速建立专属医院的培训平台；2、能建立不同需求的培训人员组织架构；3、轻松上传视频、建立培训教程、设置考题、还可以建立培训SOP等；4、管理者可随意查看培训效果，精确到个人和教程；5、平台提供名医线上工作室，可以最全面展示名医实力和技术；6、提供名医与基层医生互动交流与合作的通道；你有啥福利？往下戳！园区办公---绿色天然氧吧，树和草都是我们的朋友！五天双休---摒弃不规律的调休生活，妈妈不再担心你休息没朋友耍拉！股票期权---带给你的不再是单一薪资！带薪年假---拿着薪资去happy，任性！绩效奖金---能者多得，拿多少，你自己说了算！岗位晋升---一年内可无限次晋升和调薪，就看你能力！扁平管理---我们只看效率，能者说了算！下午茶---每周各种水果你爱哪样！员工活动---只要员工健康，公司无条件支持！生活补贴---你的通讯费？报！你的交通费？报！你的应酬费？报！报报报！在咱们公司，大美妞们一定会变得更白~更美~更苗条，身体也会更强~更壮~更帅气！,linux运维工程师
20-30万/年,网易集团,"岗位描述：1.  负责游戏产品运维工作；2.  负责运维平台设计及开发，实现运维自动化，提高运维效率；3.  与运维团队合作，收集与理解需求，提供解决方案，改善运维流程；4.  负责新平台（围绕运维业务）技术的调研；5.  积累并规范化系统运维开发的***实践并文档化。岗位要求1.  本科以上学历，计算机相关专业；2.  两年以上运维相关、系统开发等工作经验，熟悉运维流程，能够独立完成自动化运维平台的开发，如监控、部署、配置等；3.  熟悉Linux以及主要Unix系统，了解网络基本技术、熟悉TCP/IP协议工作原理；4.  掌握至少一种脚本语言，如Python、Bash、Ruby、PHP等；5.  熟悉Web相关技术，包括apache/nginx/tomcat/jboss等应用的挂历、配置和优化；6.  良好的编程习惯并能推动代码规范化；7.  有较强的沟通协调能力，工作认真细致，有强烈的负责心，良好的团队合作精神，积极主动的工作态度，能独立解决线上问题。以下是加分项：8.    熟悉大型网站运维工作，有运维开发经验者优先；9.    熟悉前端技术，如CSS，JQuery，AngularJS等；10.  熟悉分布式系统原理，有Zookeeper、、MQ等部署使用经验；11.  熟悉大规模数据处理，有Hadoop、Scribe, Storm等开发经验。",运维工程师
7000-12000/月,广州幻嘉网络科技有限公司,岗位职责：1、负责游戏服务器搭建和维护；2、游戏服务器的监控，日志分析，故障排除，性能调优；3、游戏的日常技术运用维护，事务处理；4、游戏文件和数据备份，系统安全的规划和执行；5、研究运维相关技术，游戏服务器性能调优，架构优化，根据需求制定运维技术方案。任职要求：1、精通Linux，熟悉Linux下常用的软件工具；2、熟悉MySQL、MongoDB、ssdb、redis等数据库的维护和优化，主从复制，数据备份和恢复；3、熟练掌握LAMP、LNAP系统搭建，参数配置与调优，nginx正反向代理配置；4、掌握shell编程，熟悉PHP、Python语言任意一种语言优化；5、熟悉cacti、nagios、zabbix等监控软件配置和使用；6、有运维平台开发经验，熟悉ansible、pupet自动化运维工具优先；7、熟悉使用网络相关的工具，能够定位和解决常见的网络问题；8、对系统安全，入侵检测等有一定了解，能根据服务器的情况制定相应安全措施；9、有二年以上的网游运维经验,运维工程师
6000-7999/月,广州晶绮信息科技有限公司,"岗位职责：1.负责公司基础运营平台的建设维护工作，据公司业务系统需求，协调相关资源，制定应用部署方案；2.集群系统及基础平台业务系统的管理维护、服务监控分析、故障排查，以及应急故障响应；3.研究平台服务架构，发现潜在问题，制定系统的调整和优化方案，提高系统的健壮性和服务效率；4.制定相关技术文档及操作流程；5.对相关新技术进行调研，幵尝试新的系统解决方案；6.工作积极主动，听从领导安排，与部门团结合作 。任职要求：1.熟悉操作系统原理、丰富的UNIX/LINUX系统维护经验；2.了解Shell编程，熟悉Perl或Python等脚本语言尤佳；3.熟悉UNIX/LINUX下Nginx/Apache/resin/php/mysql等应用服务的配置、管理；4.熟悉Lvs,DNS，SQUID，Gfs/Nfs,Rsync服务的配置维护，深入了解TCP/IP协议；5.有较强的安全意识，有LINUX内核Tuning & Hacking及Troubleshooting经验为佳，对系统资源(如IO，内存)性能优化有一定经验；6.对缓存技术（OsCache/ehCache/Memcached等）有较深入的应用及研究；7.熟悉java性能调优，对JVM运行机制、内存管理有一定研究 。",应用运维工程师
7000-17000/月,广东万事泰集团有限公司,岗位职责1、负责研究所服务器架构设计与建设；2、负责研究所项目服务器端平台开发、测试、维护；3、协助编写整理项目相关文档的；4、持续对技术架构进行完善优化，并进行适当的技术储备。任职要求1、三年以上Java开发工作经验，两年以上的互联网领域开发经验；2、熟悉TCP、HTTP协议，有Socket编程相关经验优先；3、精通关系型数据库（MySQL）、非关系型数据库（MongoDB）的应用开发；4、掌握Spring MVC、MyBatis、Hibernate等流行框架的运用；5、有丰富的Tomcat、Nginx集群服务部署、优化经验优先；6、能独立阅读英文技术资料，有阅读开源代码经验者优先。7、有基于node.js、python服务器端开发经验优先8、有OT硬件云开发经验优先欢迎符合要求的人员将简历投至我司邮箱：hr03@mastergroup.com.cn联系电话：0766-2925786此岗位上班地点：云浮市新兴县（总部），管吃住，可接受均可投递；,服务器架构工程师
10000-14999/月,深圳市彩讯科技有限公司,1、负责应用系统架构设计、应用部署规划、系统优化；2、负责运维服务持续交付；系统管理、应用管理、安全管理及技术方案评审；3、负责产品发布及系统变更管理、troubleshooting及故障管理；4、负责自动化运维框架的构建与实施；5、负责运维体系建设及内部工作流程建设；6、负责组织内部技术交流与培训；7、负责制定团队绩效目标，团队成员绩效沟通与考核；任职要求：1、3年以上Linux系统运维经验及2年以上技术团队管理经验；2、掌握计算机网络及系统原理，熟悉Nginx/Tomcat/Apache等中间件管理和优化；3、掌握Shell/Perl/Python任一脚本编程及日常维护；4、掌握数据库原理及SQL，熟悉Oracle/Mysql数据库部署与应用；5、熟悉开源分布式应用监控解决方案，如Nagios/Zabbix/Icinga/Ganglia等；6、了解自动化运维框架及工具，如puppet、ansible、Git、SVN等；7、有大规模、高并发、高可用系统构建、实施与维护经验尤佳。,项目经理
3000-5000/月,北京睿智融科控股股份有限公司,"岗位职责：1、负责公司业务平台的正常运行，协助定位并排除故障；2、负责公司产品的维护及售后，已经公司业务服务端的维护；3、负责相关故障、疑难问题及时的排查和处理, 各类突发故障和事务的应急响应；4、客户投诉的接洽与处理，对客户的投诉给出合理的解释，并实施相应处理；5、公司新业务执行的技术支持，保证业务的准确执行；任职资格：1、计算机及相关专业专科以上学历；2、至少熟悉如下一种脚本语言，比如shell、perl、python等；3、掌握nginx、iptables、mysql等linux下常见配置；4、强烈的责任心，良好的沟通和推动能力；5、工作地点为广州。",Linux运维工程师
8000-15000/月,广州致诚健康咨询有限公司,"工作职责：1、参与整个项目的架构与设计，项目团队的管理。2、负责公司网站、电子商务平台、手机端H5页面的前端设计制作、二次开发、修改、维护工作；3、负责Android/IOS  APP后台系统的开发和运维，改善app平台系统的性能，提升用户使用体验；4、有解决高并发、大用户量的能力，能快速发现并解决软件缺陷和问题；5、app中间件的设计和研发；6、负责APP后端应用规划及架构设计，能够出具完善的应用实施解决方案，包括：系统架构设计、接口规范制定、技术文档编写等；7、根据产品需求，进行APP及网站的后端开发；8、客户端单元测试用例编写和产品文档编写的知识沉淀，对产品的技术架构、后端开发的流程、规范等负责。岗位要求：1、本科或以上学历，3年以上互联网JAVA后台开发经验；2、精通java，熟练掌握java网络编程，熟练运用开源软件包（spring/hibernate/struts2）；3、熟悉互联网开发模式，清晰理解缓存，缓存设计和模式,熟悉memcache、redis等，熟悉c、c++等者优先；4、熟练掌握sql语句，熟练使用数据库（oracle、mysql）；5、熟练使用eclipse/maven/ant/svn等软件开发工具；6、熟悉html/javascript/css/ajax 等页面技术；7、精通tcp/ip、http等网络协议，熟悉socket网络编程，有用java做大访问量高压力网络应用的经验；8、熟悉linux/nginx，熟练配置维护apache、tomcat,等应用服务器，掌握shell/python等系统脚本工具；9、移动APP和电商行业开发经验优先。",网络开发工程师（中高级）
4500-5999/月,广州联图电子科技有限公司,1、负责服务器的系统、应用运维工作，包括应用配置管理、系统发布、系统监控、系统升级、系统安全、性能优化等工作；,运维工程师
8000-15000/月,广州市玄武无线科技股份有限公司,岗位职责：1、根据公司、部门要求完成日常的运维工作；2、根据部门流程要求完成相应的日常预警工作；3、根据部门要求完成日常值班要求；4、响应三方部门的业务查询请求；5、配合三方部门进行服务调整、业务调整工作；6、配合技术进行平台升级及调整工作；7、根据公司业务方向进行现有平台的运维优化工作。任职要求：1、本科学历（统招），2年以上中大型企业实际运维工作经验；2、深入理解Linux、windows系统，熟悉 Windows/Linux操作系统常用命令；3、对Nginx、Apache、IIS、Tomcat、MySQL等有一定的维护经验；4、熟悉shell编程，熟悉Python、Ruby、Perl、php等一门动态语言；5、熟悉Cacti等监控工具的使用及配置。,运维工程师
15000-19999/月,世纪龙信息网络有限责任公司,一、岗位职责1、流量网关SOCKS5代理功能设计、开发、测试、部署和维护；2、流量网关HTTP代理功能设计、开发、测试、部署和维护；3、流量网关客户端底层网络相关功能调研、设计、开发、测试、部署和维护。二、岗位要求1、精通Linux C编程，熟悉常用的数据结构和算法；2、熟悉TCP/IP网络编程、进程间通信和多线程开发；3、熟悉SOCKS5代理和HTTP代理原理，有TCP、UDP或HTTP协议分析经验者优先；4、掌握至少一种脚本语言（Shell、Lua或者Python）；5、熟悉常见开源软件，如nginx，redis等。,Linux C高级研发工程师
8000-9999/月,广州鼎梵数码科技有限公司,岗位职责：1、保障音乐平台生产系统的高效稳定运行，负责监控系统、数据收集和数据分析等系统运维工作；2、反馈系统运行数据给开发团队，提出相应的优化意见。任职资格：1、计算机及相关专业本科以上学历；2、三年以上运维经验，一年以上的大中型网站运维经验优先；3、熟练Linux、apache、Nginx、Tomcat、squid、memcached等常用互联网基础服务的配置和优化；4、熟练MySQL数据库的管理和维护，有数据库优化经验优先；5、至少熟练掌握shell/python/perl 三种语言中的一种，有java开发经验尤佳；6、了解网络原理和存储技术，熟悉网络相关配置；7、具有一定的英文阅读能力；8、有较强的沟通及协调能力，学习能力强，做事沉稳细致，具有良好的文档编写和文字表达能力。,高级运维工程师
20-30万/年,科大讯飞股份有限公司,岗位职责:任职资格:1、支持业务上线、架构设计部署，测试环境运维；2、测试环境故障处理，分析定位原因并解决；3、分析系统瓶颈，容量评估，架构改造等工程；4、参与架构优化、容灾优化、性能优化等项目；5、负责测试环境自动化工具编写和配置，提高测试运维效率和质量。1、本科或以上学历，5年以上相关工作经验；2、深入了解Linux系统以及优化，具备Linux下编程经验，熟练使用grep、awk、sed等系统工具，擅长(shell/perl/python)脚本语言编程，实现自动化运维；3、熟悉主流开源软件(Nginx/Tomcat/Nodejs)的配置及调优；4、深入理解网站高可用性架构：lvs/Haproxy/F5/Twemproxy，以及Nosql相关（Memcache/Redis）等；5、对技术文档编写规范有一定了解，有大、中型项目维护实战经验者优先；6、良好的沟通和语言表达能力，逻辑清晰，学习能力强，有自我激励能力，乐于承担工作压力，责任心强。,华南公司-服务器研发经理-广州
