salary,company,jobcont,jobname
20000-30000/月,三七互娱（上海）科技有限公司,"职位描述：1.互联网游戏行业平台和产品的后端存储架构设计。2.存储架构需满足用户大规模增长时的可用性。3.负责大数据统计分析架构的设计和搭建，给出专业指导意见。4.带领团队进行DB运维自动化平台建设。5.带领团队进行后端存储的技术选型和架构实现，解决技术难题，为业务提供稳定性保证。6.云DB运维的平台化实现。任职要求：1.了解mysql高可用架构方案，熟悉mha，mmm，xtrabackup等开源组件。2.熟悉至少一种关系型数据库(mysql,oracle,postgresql等)和nosql数据库实现(redis,mongodb)。3.深入理解一种数据库原理，mysql或pgsql等。4.对DB自动化运维有一定理解并付诸实际，有云DB运维和设计经验更佳。5.对shell，python，perl，php至少掌握2门语言以上，能够写出高效脚本，程序。6.熟悉至少一种开源大数据存储方案(HBASE,cassandra，GPDB)，有spark或者hadoop经验更佳。7.有中大型应用系统分布式架构设计经验，独立承担过中大型系统存储架构设计和搭建。职能类别：数据库工程师/管理员关键字：数据库管理DBA举报分享",高级数据库管理(DBA)
10000-14999/月,三七互娱（上海）科技有限公司,职位描述：1、项目计划制定实施跟进，游戏上线与运营相关事宜；2、游戏产品修改与优化，监控项目组游戏相关数据，保证游戏正常运营；3、线上线下游戏活动策划与执行，活动效果评估分析；4、各项数据整理分析，项目成本优化控制；任职要求：1、本科及以上学历，对游戏有深入的认识，两年以上游戏运营经验；2、高执行力，高投入度，能在较大压力下保持良好的工作状态；3、较强团队合作精神，品行端正.责任心强，具备严谨.踏实的工作作风；4、有较强的组织沟通及表达能力，应变及协调能力强；5、善于思考，具备较好的学习能力和理解能力；6、对数据敏感，拥有较强的数据分析能力。职能类别：产品专员关键字：越南语泰语举报分享,海外运营专员（泰语、越南语）
15000-19999/月,三七互娱（上海）科技有限公司,职位描述：职责概述：1、主导平台网站核心系统的架构设计，带领技术团队完成网站项目整体系统构架设计；2、参与产品开发可行性讨论，对产品的需求进行全方位的理解和把控；3、负责项目的任务分配分解、进度跟踪，保证项目按时按质完成；4、负责技术难题预研与攻关，解决系统中关键架构问题，对系统稳定性负责；5、制定员工培养计划，建设稳定、高效、有活力的技术团队。岗位要求：1、开发工作经验3年以上，其中带团队经验2年以上；2、丰富的网站、手机端开发经验，精通php，熟悉前端开发程序，了解iOS/Android开发技术；3、具备出色的项目管理/计划能力，思路清晰，善于交流，有良好的团队合作精神和跨部门协调能力；4、性格积极乐观诚信，有强烈的进取心。职能类别：项目主管技术总监/经理关键字：技术主管团队管理项目管理举报分享,技术主管
5000-8000/月,三七互娱（上海）科技有限公司,职位描述：岗位要求：1、负责业务合同的财务审核、付款审核、消耗表编制和分析；2、负责工作相关单证、文件、重要数据等进行归档管理，及时更新档案清单。3、负责会计凭证的录入、管理和数据提报；4、负责与业务部门的日常沟通，能协助上级建立和完善事业部相关业务的财务流程、制度；5、负责财务经理安排的其他财务相关工作；任职资格：1、数据敏感度高，能从数据中发现问题并解决问题；2、财务、会计、金融或相关财会专业本科以上学历；3、有同类岗位一年以上工作经验，熟悉用友和金碟财务软件；4、善于全盘账务出具、审核和调整，能主动思考，独立工作能力强；5、善于沟通，工作仔细，认真负责，承压能力强，有团队合作精神。6、有软件行业或广告行业从业经验优先，具备会计师职称优先。7、有会计师事务所工作经验优先考虑。职能类别：会计举报分享,会计
15000-19999/月,三七互娱（上海）科技有限公司,职位描述：三七互娱2017校园招聘--世界因我而乐游戏江湖无限精彩，娱乐世界因我而乐从红白机旧史，到VR游戏时代，游戏一直陪伴着我们昨天游戏给我们带来欢笑，今天我们给世界创造快乐怀揣游戏梦想的你，现在就打开游戏世界的大门！三七互娱2017校园招聘欢迎你高年薪、壕福利、好团队、强产品与你仅仅只差一份简历的距离三七互娱2017校园招聘行程安排城市	宣讲高校	宣讲日期	宣讲时间	宣讲地点广州	中山大学	2016年9月12日	14：30	大学城行政楼B102华南理工大学	2016年9月13日	14：30	大学城A4-204报告厅长沙	湖南大学	2016年9月22日	-	待定中南大学	2016年9月23日	14：00	校本部科教南楼402成都	电子科技大学	2016年9月22日	14：30	清水河校区立人楼B206四川大学	2016年9月23日	14：30	望江校区就业指导中心201报告厅武汉	武汉大学	2016年9月27日	14：30	就业指导中心第三报告厅华中科技大学	2016年9月28日	14：30	国际学术交流中心      8号楼报告厅西安	西安交通大学	2016年9月27日	14：30	就创中心一楼信息发布厅西安电子科技大学	2016年9月28日	14：30	南校区就业中心116上海	上海交通大学	2016年10月17日	-	待定上海复旦大学	2016年10月18日	-	待定北京	北京邮电大学	2016年10月17日	-	待定北京航空航天大学	2016年10月18日	-	待定PS：宣讲会结束后有笔试安排通知，接收现场投递简历关注各地宣讲会，更多惊喜等着你！入场有礼：按照入场时间顺序，可获得精美入场礼品一份，送完即止；微信送礼：关注三七互娱招聘微信公众号：三七互娱招聘 ，宣讲会现场就有机会获得神秘大礼哦！【校园招聘流程】网申—宣讲会—笔试—面试—正式录用—发放offer网申地址：http://zhaopin.37.com 或关注三七互娱招聘微信：三七互娱招聘 投递简历【招聘岗位】游戏研发类数值策划、系统策划、执行策划、C++服务端程序、Java服务端程序、Unity3d客户端程序、Cocos2d-x客户端程序、页游客户端程序技术支持类前端开发工程师、Android开发工程师、PHP开发工程师、网站工程师、数据挖掘算法工程师、安全工程师、运维开发工程师、运维工程师、测试工程师游戏运营类页游运营专员、手游运营专员、海外运营专员、本地化专员、海外广告专员、推广专员、数据分析专员美术设计类广告设计师、平面设计师、网页设计师、视频设计师、原画设计师、UI设计师、特效设计师、动作设计师、模型设计师、场景修图商务市场类市场策划、媒介执行、广告投放专员职能管理类人力资源专员、投资助理、会计岗位详细说明请点击：http://zhaopin.37.com职能类别：多媒体/游戏开发工程师举报分享,三七互娱2017校园招聘 --世界因我而乐
8000-10000/月,三七互娱（上海）科技有限公司,职位描述：职位描述：1、负责游戏产品内容宣传计划制作，执行跟进及总结分析；2、完成日常媒体覆盖，包括新闻、礼包、开服表、开测表、入库等资源覆盖；3、媒体专题活动策划跟进与制作上线，及评估效果分析；4、协调媒体各类资源深度合作，媒体资源购买与投放、执行；5、协助策划和召集举行各类重要会议及公关活动；7、媒体传播、市场动态监控，危机公关处理等。任职要求：1、具有2年以上媒介/市场从业经验，具备媒体价值分析能力及媒体效果评估能力，熟悉游戏相关媒体资源者优先；2、性格开朗，亲和力强，具有良好的沟通协调与社交能力，擅长团队协作；3、思维活跃，具有敏锐的市场洞察力和较强的开拓精神，并能承担一定的工作压力。职能类别：媒介专员举报分享,高级媒介专员
6000-10000/月,三七互娱（上海）科技有限公司,职位描述：岗位职责：1.负责SEM投放策略和优化策略制定及执行，对投放数据进行监控和分析；2.熟练掌握baidu，360，搜狗，DSP一项或多项推广后台操作；3.定期提供数据分析报告，并提供切实可行的优化方案，保证SEM推广正常有效推进；4.监控和研究竞争对手的搜索营销策略，关注搜索媒体的变化，提出调整优化方案。岗位要求：1.本科及以上学历 ；2.具有SEM从业经验，了解搜索引擎用户特征，对游戏行业熟悉或了解者优先 ；3.具备良好数据分析能力，可独立完成专业投放报告 ；4.工作认真负责，踏实肯干，抗压性强。有良好的沟通能力和学习能力，有团队合作意识。职能类别：市场分析/调研人员SEO搜索引擎优化举报分享,SEM推广专员
8000-15000/月,三七互娱（上海）科技有限公司,职位描述：职位描述：1、策划制定公司企业文化活动方案并组织实施，定期组织各种形式的企业文化主题活动和员工关怀活动；2、策划全年各节日和季节性的员工活动及员工关系会议等，活跃员工气氛，增强员工认同感；3、公司文化建设和推广引领、驱动公司文化发展，激励员工实现自我价值；4、负责企业内部文化宣传制作，参与创意和设计，编辑企业宣传文案。职位要求：1、本科及以上学历，有亲和力，工作热情积极，沟通能力强，组织协调能力强；2、1年以上企业文化、员工关系工作经验，互联网/电子商务行业从业经验优先；3、擅长公文写作和企业文化活动策划，熟悉员工活动建设及开展的相关流程并可以独立进行方案整合，有丰富的独自策划、实施员工活动和文化建设项目经验；4、热衷于员工沟通和关系管理，具备和掌握开展相关工作的理论知识和行动方法论；5、具有一定的文字功底和图片处理能力，熟悉公文写作，了解内刊制作的基本流程和知识；6、有创意思维，对新鲜事物抱有好奇心，对色彩搭配敏感，乐于学习分享。职能类别：企业文化/员工关系/工会管理演员/群众演员举报分享,员工关系专员
6000-7999/月,三七互娱（上海）科技有限公司,"职位描述：招聘需求：岗位职责：1.负责日常的游戏视频广告制作。2.根据游戏产品宣传需求，独立完成游戏宣传片的制作（包括创意 、分镜、包装、剪辑、配音）。岗位要求：1.大专以上学历，热爱游戏，对摄影有兴趣、有游戏视频制作相关工作经验者优先。2.精通AE,Premiere等相关视频软件，有一定的PS、Flash软件使用基础。3.具备较好的美术基础，对视频的镜头、节奏、色彩、画面、创意等有较好的把握。4.有良好的团队协作能力和创新意识。5.投递简历时，请附上个人作品。职能类别：语音/视频开发工程师后期制作举报分享",视频设计师
3000-4499/月,三七互娱（上海）科技有限公司,职位描述：岗位职责：1. 网络上解答和处理玩家反馈的游戏问题；2. 监控游戏运行状态，维护游戏世界的正常秩序；3. 及时反馈和协助处理游戏异常状况，并与玩家做好沟通；4. 对工作或产品问题进行反馈并提出改进建议；5. 提供运营服务，处理运营问题，研究运营数据，提升运营质量；6. 了解用户需求，用心为每一位玩家提供周到的服务。任职资格：1. 20-28岁，性别不限；专科及以上学历，专业不限；2. 有较强的逻辑思维能力和问题分析能力；3. 优秀的团队合作精神，善于沟通，乐于助人；4. 具备良好的学习能力，善于学习和掌握新技能，有创新精神；5. 思维敏捷，善于表达自己的观点和意见；6. 具备良好的服务意识，能承受较大的工作压力；7. 打字速度块，60字/分钟以上 。8.形象优，气质佳，18-25岁的职能类别：客服专员/助理举报分享,手游客服专员
6000-7999/月,三七互娱（上海）科技有限公司,"职位描述：岗位职责1.负责搜集了解行业信息，了解市场信息、产品动态及趋势，完成优质游戏引入工作；2.负责合作伙伴的开拓、洽谈、维护（包括产品接入、对接跟进、后期维护）；3.全面收集游戏CP的基础信息，并通过联络、拜访等途径，与CP建立起长期友好的合作关系，促成与优质CP的深度合作。职位要求1. 热爱游戏；2. 计算机、电子商务、市场营销、管理类及相关专业；3. 熟悉互联网及游戏行业内合作运营的具体情况,拥有一定区域或平台人脉资源;4. 拥有合作运营的具体工作经验;5. 具备良好的谈判沟通能力，并有很强的人际交往能力；6. 一年以上商务工作经验,具有互联网或游戏类工作经验者优先。7.能接受出差工作，具有一定抗压能力。职能类别：商务主管/专员产品专员关键字：游戏引入手游商务cp维护举报分享",手游商务专员
20000-30000/月,三七互娱（上海）科技有限公司,职位描述：1、负责制定和实施针对集团业务系统的安全规范及流程；2、负责网络安全防御系统的建设、维护与管理；3、负责业务系统安全风险评估并持续跟踪管理；4、负责自动化安全工具的开发、测试以及规则优化管理；5、负责跟踪分析行业内安全动态、研究安全攻击、防御相关技术；6、负责日常安全事件的响应和分析处理。要求：1、大学本科以上计算机、信息安全相关学历，至少3年以上信息安全行业经验；2、熟悉风险评估技术，熟悉相关安全标准和规范，安全体系；3、熟悉网络安全技术:包括端口、服务漏洞扫描、程序漏洞分析检测、权限管理、入侵和攻击分析追踪、网站渗透、病毒木马防范等；4、熟悉tcp/ip协议，熟悉sql注入原理和手工检测、数据包结构、ddos攻击类型和原理，有一定的ddos攻防经验，熟悉系统常用安全检测技术；5、精通PHP\PYTHON\C++其中一门或多门语言并具备实际安全产品开发经验。职能类别：网络信息安全工程师关键字：网络安全举报分享,高级网络工程师
8000-9999/月,三七互娱（上海）科技有限公司,职位描述：岗位职责：1.项目计划制定实施跟进，负责游戏上线与运营相关事宜2.游戏产品修改与优化，游戏BUG及玩家建议提交，配合客服解决玩家的问题3.密切监控项目组游戏相关数据，及时发现问题解决问题，保证游戏正常运营4.线上线下游戏活动策划与执行，活动效果评估分析5.游戏市场推广，推广渠道优化，广告素材优化6.各项数据整理分析，做好项目成本优化控制，提高项目利润及利润率任职要求：1、大专以上学历，具有2年以上游戏运营或市场运营经验；2、熟知国内外各类主流的网络游戏，对主流网络游戏及发展历史有深入认识；3、了解用户和需求，注重用户感受及体验，有良好的网页游戏运营触觉，善于把握页游戏玩家的消费、喜好心理；4、非常强的计划统筹能力，全面负责运营数据分析及网游产品市场调研工作，针对市场变化制定相应策略；5、思维敏捷，高抗压能力，有知名互联网游戏公司工作经验者优先。职能类别：网站营运专员关键字：带薪年假年终双薪奖金丰厚人才推荐奖举报分享,东南亚手游运营
8000-9999/月,三七互娱（上海）科技有限公司,职位描述：岗位职责：1.负责公司日常平面设计工作 （企业文化宣传及公司VI设计、企业宣传手册、周边产品设计等）2.根据推广宣传方案，进行大型展会、游戏线下活动、品牌宣传等各大型项目相关物料设计3.负责微博、微信线上活动相关图片设计（包括游戏推广图、招聘图、各搜索门户品牌广告设计等）岗位要求：1.对游戏行业有一定了解，有广告公司经验者优先；2.精通PS、AI等相关平面设计软件，具备基本的flash动画设计以及一定的手绘能力；3.熟悉印刷、喷绘等后期制作流程，懂得把控材质和印刷成本；4.具有把握不同风格设计的能力，思维活跃、创新能力佳；5.熟悉互联网行业，对品牌营销、广告策划等方面有一定了解；6.具备良好的抗压能力、团队协作意识；工作积极主动、传播正能量。职能类别：平面设计师举报分享,高级平面设计师
1500以下/月,三七互娱（上海）科技有限公司,职位描述：假如你是◆    上海交通大学、上海复旦大学在校大学生；◆    在校内有一定人脉资源及号召力，有社团、学生会经验或类似校园大使经验同学优先；◆    有良好的协调、应变能力，强烈的团队意识和协作精神，主动性和执行力强。假如你可以◆    全程参与2017校园招聘在当地院校的前期宣传、面试等招聘环节；◆    重点负责集团在目标院校的前期宣传，包括海报、传单的发放，班级群、微信、校园BBS等网上平台的推广等；◆   协助集团与学校各部门、学生会等联系沟通，配合公司在校园内的招聘活动。你将获得◆   大型企业校园招聘工作全程参与锻炼机会、开阔视野；◆   工作表现优异者可于本人求职季获公司校园招聘面试绿色通道，优先录用；◆   棒棒哒的工作报酬。报名通道◆   将简历发送给我们◆   简历筛选合格者，会在3个工作日里面通过电话联系，请保持通话畅通。职能类别：其他举报分享,校园大使（上海交通大学、上海复旦大学）
10000-20000/月,三七互娱（上海）科技有限公司,职位描述：岗位职责：1、培训体系的完善与运行 ：负责课程培训体系、讲师管理体系等培训相关工作的整体规划和运营；2、培训需求调查：负责组织开展内、外培训需求调查，针对不同层级员工的培训需求，制订培训计划；3、培训课程开发、培训项目及活动的设计和执行：负责设计符合公司需求的专题培训项目和员工活动，并负责实施；4、组织并实施员工的职业发展计划；5、对培训效果进行评估，跟踪培训效果及学员行为的转化；定期对员工训后学习掌握情况进行抽查考核，根据考核情况进行后续培训安排。岗位要求：1、本科或以上学历，大型企业培训工作经验，大型培训活动的组织、策划、授课等能力；2、较强的系统思考和规划能力，具有成功的培训项目管理工作的经验；3、具备较丰富的培训活动策划、实施、监控经验，掌握培训效果评估方法，熟悉公司内、外部培训流程；4、高度的工作责任感和问题解决能力；沟通协调能力强；较好的文字功底和语言表达能力；5、互联网工作经历者优先考虑。职能类别：培训经理/主管举报分享,培训经理/总监
8000-9999/月,三七互娱（上海）科技有限公司,职位描述：职位描述：1、依据各游戏产品市场策略制定详尽的海外地区推广宣传计划，对产品宣传结果负责；2、线上、线下活动的策划、执行、推进、分配、计划、后续效果的跟进回馈；3、异业合作的开拓、执行及维护；4、合作伙伴的拓展与日常维护；素质要求：1、1－2年游戏相关市场推广工作经歷（条件优秀者可放宽）；2、热爱游戏，对游戏有激情，有追求；3、对游戏行业瞭解深入，精通多款网路游戏，熟悉游戏推广宣传；4、具备良好的沟通能力，媒体分析能力，能承受较强工作压力，有强烈责任感；5、具备较良好的英语读写能力；6、有手机游戏推广经验、熟悉APP Store及Google Play推广者优先。职能类别：市场企划专员市场/营销/拓展专员举报分享,海外市场策划
10000-14999/月,三七互娱（上海）科技有限公司,"职位描述：职位描述：1、各产品线Web端功能设计、开发和实现；2、对各产品线易用性改进和前端优化提出可实现的解决方案；3、配与后端同事配合完成项目。任职要求：1、本科及学历，2年以上相关工作经验；2、精通HTML,CSS,JavaScript,dom,ajax等前端开发技术，熟悉流行的框架库，能熟练编写扩展性，兼容性，可读性良好的代码；3、熟练使用前端自动化集成工具，grunt，fis，glup；4、有强烈的团队意识和执行力；5、有后端脚本语言开发经验者优先，有H5开发经验者优先。职能类别：Web前端开发举报分享",前端工程师（国内）
10000-14999/月,三七互娱（上海）科技有限公司,"职位描述：职位描述：1、负责公司内部与广告业务页面的维护及页面内容修改；、2、负责公司各业务专题页面的制作和维护；3、根据运营平台需求参与游戏印象站、悬念站等Flash制作4、制作新接入的游戏官网页面，并且搭建后台。任职要求：学历：本科1、本科以上学历，计算机相关专业，2年以上前端开发工作经验；2、熟练网站开发网站的必要技能，能较好的完成其他部门所提出的需求；3、熟练js代码的开发能力,具备html代码div+css的开发能力，对html5,css3有了解；4、掌握软件Adobe Flash Professional的使用，熟悉flash制作流程；5、熟悉Action Script2.0 、Action Script3.0语言和后端程序调试页面程序的能力；6、具有较强的沟通能力，分析和解决问题的能力，具备良好的团队合作精神。职能类别：Web前端开发举报分享",前端工程师
8000-9999/月,三七互娱（上海）科技有限公司,职位描述：职位描述：1、负责手游平台产品的运营、维护管理以及用户管理等工作；2、手游平台运营的数据收集及分析，并制定相应的产品推广和运营策略;3、负责线上专题活动的策划及执行，协调各方面需求及推进；4、监控相关业务流程的关键过程和结果，协调和推进各部门的业务进度和业务结果;职位要求：1、大专及以上学历，至少两年以上大型网站或平台运营经验，有同类游戏平台运营经验优先；2、对社会热点把握能力好，能结合当前热点进行内容/推广运营；3、有成功产品运营/推广经验，了解CRM，对用户体验与用户心理方面有较好的理解；4、较强的逻辑思维能力与市场策划能力，有创新精神；5、了解平台基础设施，如网页、游戏盒子等；6、善于思考对数据敏感，较强的数据分析能力；职能类别：网站营运经理/主管举报分享,平台运营主管/经理（手游）
20000-35000/月,三七互娱（上海）科技有限公司,"职位描述：1、开发美术制作工具，优化美术工作流程；2、根据美术需求，设计shader；3、跟进美术资源，确保资源符合引擎规格；4、研究游戏引擎，帮助美术人员使用引擎和工具；5、协助美术人员和程序人员优化游戏运行效率；6、解决美术人员日常遇到的各种技术问题。任职要求：1、3年以上游戏开发经验，2年以上技术美术工作经验；2、至少熟悉一类商业引擎, unreal和unity3d优先；3、精通3dmax及maxscript；4、熟悉渲染管道，熟悉shader编程；5、对计算机图形图像技术和游戏机硬件有深入的了解；6、良好的英文能力，较强的学习能力；7、良好的沟通能力，积极主动，乐于助人。【福利待遇】双休、月结项目奖金、年终奖、餐费补贴、通讯报销、全勤奖、早餐+下午茶、五险一金、年度体检、优秀员工奖、带薪休假、年会抽奖、其他：节假日福利、员工家庭活动、俱乐部、相亲活动......【应聘方式】请将过往 简历作品 发送至QQ：2880092274@qq.com标题备注：技术美术-姓名备注：办公地址：广州天河有发作品会优先处理，也可直接加Q离线发简历作品。职能类别：其他举报分享",技术美术/TA
