salary,company,jobcont,jobname
6000-9000/月,三七互娱（上海）科技有限公司,职位描述：岗位要求：1、负责协助税务经理组织拟订企业整理税务计划；2、负责管理各种发票，包括购买、领取、登记、对外开具发票等；3、负责办理公司各种税务更换证及年检工作；4、负责协助编制及进行公司各税种的纳税申报；年末协助进行各公司的企业所得税汇算清缴；5、负责协助申请、报批公司有关税收优惠政策（研发费用加计扣除、软件企业的税收优惠等）的手续，加强公司同税务、统计等部门的联络6、负责准备税务检查的相关资料7、学习并搜集相关税收法规；对公司新项目，协助完成相关税收筹划方案8、负责给予公司其他业务部门相关税务咨询，确保公司日常运作9、负责完成主管及经理安排的其他工作任职资格：1、了解掌握国家、地方的财税政策；熟悉双软年检、各地区税收优惠政策及软件企业退税政策等；2、财务、税务或相关专业本科以上学历；3、有同类岗位2年以上工作经验，熟悉国家、地方各项税务政策，有具体办税经验；4、能主动思考，独立工作能力强，时间管理能力强，能适应必要的出差，以完成税务申报工作；5、善于沟通，工作仔细，认真负责，承压能力强，有团队合作精神及快速学习能力。6、有软件行业或集团公司从业经验优先，具备税务师职称优先。7、有会计师事务所工作经验优先考虑。职能类别：税务专员/助理关键字：带薪年假奖金丰厚全勤奖人才推荐奖话补立即上岗举报分享,税务专员
5000-8000/月,三七互娱（上海）科技有限公司,职位描述：岗位职责：1、负责手游渠道的运营工作支持，跟进各渠道合作情况；2、定期输出渠道运营数据报告，跟踪渠道投放效果；3、深入分析合作渠道特性，制定合理、有效的渠道产品及运营策略；4、策划渠道侧运营活动，对渠道产品、流程及页面进行策划或优化，提升运营指标。任职要求：1、熟悉手游市场，了解手游运营过程；2、有渠道运营工作经验优先；3、具有良好的数据敏感度、数据分析能力及广告素材优化能力；4、具备优秀的自我驱动力、沟通能力、团队协作能力及跨部门协作推动力。职能类别：网络推广专员其他关键字：渠道运营渠道数据数据分析素材优化游戏运营举报分享,渠道运营专员
5000-8000/月,三七互娱（上海）科技有限公司,职位描述：岗位职责：1、负责微信公众号的工作规划和整体运营；2、兼顾平台积分商城运营；3、善于数据分析，对平台的运营数据能够进行分析汇总成各种报表；4、使用有效手段发展粉丝和拓展积分业务使用率；5、对客服消息的归类分析，对客服团队有一定指导；6、对热点、爆点要有足够敏感度，能做出相应的宣传。任职要求：1、精通相关平台的运营方式；2、有团队合作精神，能与产品、技术、客服人员交流配合，善于思考分析；3、扎实的文字功底，具备较强的文案策划功底以及活动策划能力，熟悉微博、微信运营、口碑营销；4、能够单独完成项目创意、策划到执行；5、擅长社会化媒体平台（微博、微信、论坛）营销者，重度移动互联用户；6、有微信微博运营或积分商城工作经验优先。职能类别：网站编辑网站营运专员关键字：平台运营内容编辑新媒体运营举报分享,平台运营专员（手游）
15000-19999/月,三七互娱（上海）科技有限公司,职位描述：职位描述：1、主要负责集团泛娱乐（游戏、影视、IP合作、音乐等等）业务的合同审核及风控体系的搭建；2、参与商业谈判，起草相关交易文件，提出法律优化建议；3、投资&并购项目的法律支持，具有开展专项法律调研及出具针对性解决方案的能力；4、围绕知识产权以及商事争端开展法律风险识别，并处理相关争议解决事项，捍卫公司利益。任职要求：1、知名法学院硕士学位获得者（特别优秀者，本科亦可），执业4年以上或具有同等法律工作经验，通过司法考试；2、主要从事非诉领域的法务工作，具有为业内领先的互联网或游戏公司出具法律意见的优先考虑；英文可以作为工作语言的优先考虑；3、品行正直，工作踏实细致，积极主动，乐于分享，具有抗压能力和团队领导能力，能够独当一面。职能类别：法务经理法务主管/专员举报分享,集团法务主管/经理
15000-25000/月,三七互娱（上海）科技有限公司,职位描述：岗位职责：1. 负责公司广告系统算法平台的搭建，效果评估方案的制定；2. 负责广告算法团队建设任职资格：1. 工科、计算机、数学、统计学或其他相关专业本科以上学历；2. 3年以上大数据或机器学习算法开发经验3. 有广告相关算法（Selection， Ranking，CTR预估，定向推荐）或系统经验者优先；4. 熟悉Linux开发环境和相关脚本语言；5. 有分布式系统设计、数据挖掘、海量数据处理等相关经验者优先；职能类别：互联网软件开发工程师关键字：数据广告挖掘java技术主管举报分享,广告数据挖掘工程师
8000-12000/月,三七互娱（上海）科技有限公司,职位描述：岗位职责:1、负责金流/游戏行业市场调查，市场资源洽谈，牵头开展；2、各国政策，游戏行业调研，同业情况调研；3、财务应收催收，谷歌、苹果、FB的政策分析；4、负责各游戏上线的支付流程沟通及测试工作；5、海外各国英文市场日常工作沟通交流。职能类别：公关专员关键字：渠道金流海外支付举报分享,海外支付渠道专员
15000-19999/月,三七互娱（上海）科技有限公司,职位描述：岗位职责：1、根据需求文档，使用LayaAIR引擎进行手机游戏开发；任职要求：1、至少1年以上游戏开发工作经验；2、精通javascript等前端开发技术；3、熟悉html5游戏开发框架，能独立开发；4、熟悉LayaAIR或Egret引擎，对跨平台开发有一定的经验；5、有LayaAIR引擎游戏开发经验、ARPG游戏开发经验者优先。职能类别：Web前端开发Flash设计/开发关键字：H5HTML5前端工程师举报分享,HTML5工程师
10000-20000/月,三七互娱（上海）科技有限公司,职位描述：职位描述：1、外联系互联网、文化、工商等等监管单位政府关系工作；2、了解政府对企业政策法规，文化监管互联网监管等机构；3、协助财务及公司对工商、税务、主管部门资质办理及各项日常工作配合；4、及时了解地方各项与公司事务相关的政策法规；5、政府层面提高企业的认知度和品牌形象；6、完成领导交办的其他日常工作；任职要求：1、本科以上学历，三年公关或商务工作经验（互联网行业优先）优先；2、对文化产业、信息产业、互联网产业发展趋势有良好认知；熟知广州地区政府事务，互联网行业优先；3、具有较强的社会活动能力、良好的人际交往与协调能力、逻辑思维与表达能力；4、具有优秀的文字撰写与分析能力，能够独立撰写政府公文及工作报告，政府项目申报经验.职能类别：公关经理公关主管举报分享,公共事务主管/经理（政府方向）
20000-35000/月,三七互娱（上海）科技有限公司,职位描述：1.熟悉Google ，Facebook等常用的海外推广渠道，能够熟练进行公司海外APP产品的推广投放，并分析渠道推广数据反馈，优化推广效率和效果；2.快速建立网络推广的渠道，制定全年网络广告投放的工作计划（包括：投放策略、预算制定及管理等），引入流量、带来新用户；3.对网络广告投放效果进行监控；与活动策划、运营、商务拓展团队进行紧密配合，共同实现用户活跃的目标。4.关注目标海外市场的发展状况，深入了解当地用户习惯，依据产品特点，制定推广计划；5.熟悉关于全球移动应用推广趋势。职能类别：市场/营销/拓展总监关键字：海外媒体广告总监举报分享,海外广告媒体副总监
8000-12000/月,三七互娱（上海）科技有限公司,职位描述：岗位职责：1.开展公司各流程（包括业务和财务）的常规审计，包括分析、梳理流程中现存的风险点，评价流程设计的合理性、风控点设置的有效性和测试实际执行的有效性，并据此提出优化建议，出具审计报告，完善对应制度；2.开展专项审计及审计调查工作，负责审计报告和审计调查报告相关资料与数据分析和评价审计证据，编辑审计工作底稿，形成审计结论，出具审计报告，向管理层汇报；3.协助上级跟踪审计缺陷的整改情况；4.独立或协助上级完成部门各类审计工作，向上级汇报，并协助各类报告的编制和维持高质量的文档记录。职位要求：1.具有本科及以上学位，会计、财务管理等相关专业优先。具备专业资格优先考虑，例如CICPA/ CISA/CIA等。2.具有2年或以上四大会计师事务所工作经验或相当的内部审计工作经验，四大管理咨询部门和/或熟悉网络游戏企业的内部工作流程和行业特点优先考虑。3.对企业的内部控制、业务流程以及风险和合规性程序的审计有良好了解，并且掌握内控流程分析、数据处理、数据分析。熟悉《企业企业内部控制基本规范》及其应用指引优先考虑。4.有良好的逻辑思维能力和较强的学习能力，工作细致、综合分析能力强，具有优秀的口头和书面沟通和协调能力，能独立完成任务。5.良好的计算机使用技能，并具备基础的英语能力。本岗位：不需出差。职能类别：审计经理/主管举报分享,内审主管
6000-10000/月,三七互娱（上海）科技有限公司,职位描述：岗位职责：1、  负责对业务线提供全方位的管理支持工作（HR制度流程的宣贯和落实、试用期管理、培训需求发掘、团队氛围的建设、转岗、晋升、内部竞聘、离职面谈、内部激励、协助月度和年度绩效考核工作及团队考核规则的修订等）和业务线负责人密切协作，作为可信赖的业务线伙伴角色，协助业务线负责人不断提升团队绩效2、  负责业务线人员招聘工作3、  协助业务线负责人管理组织架构调整、人员配置规划和人员编制预算、ERCase跟进4、  协助业务部门流程的梳理或优化、根据团队问题的诊断提供专业性建议及解决方案5、  建立信息共享平台，维护支持团队的人员数据，并定期做相关数据分析，提供其它增值性及配合业务的工作6、  配合其他HR模块项目及制度的落地，并及时反馈在执行过程中的各种问题，协调跟进问题的解决7、  员工关系维护：加强员工沟通管理，针对所负责的部门，定期进行员工访谈，并了解员工思想动态，给予相应地引导，并将问题进行反馈和处理任职要求：1、  统招本科以上学历2、 1年以上HR工作经验，至少熟悉3个模块（招聘优先）， 有游戏行业或互联网公司HRBP经验优先3、  具有较强的沟通影响力、统筹策划能力、执行力和独立工作能力4、  能接受高强度的工作，抗压性好，工作态度积极乐观、认真严谨5、  具备良好的学习能力和主动意识，能够主动深入业务，了解业务，对业务部门的需求时刻保持敏感性，能够承担多角色多任务的工作6、  熟悉国家和地方人事相关法律法规，熟练操作office办公软件工作地点：广州、芜湖职能类别：人事专员人事主管举报分享,HRBP(芜湖）
10000-20000/月,三七互娱（上海）科技有限公司,职位描述：1、承担公司游戏项目的运营管理，完成所负责的运营指标；2、负责本项目游戏的运营推广计划制定及有效实施；3、协调公司与合作商的各种接口及沟通工作，保证游戏的正常运行及营收；4、各项数据整理分析，项目成本优化控制；任职要求：1、本科及以上学历，对游戏运营有深入的认识，至少2年以上游戏运营经验；2、对游戏有自己的独特看法，熟悉游戏运营相关工作，有成功的产品运营案例；3、有较强的组织沟通及表达能力，有一定的团队管理能力；4、对游戏产品研发有较深了解。职能类别：网站营运经理/主管关键字：海外运营经理游戏举报分享,海外手游运营经理/项目经理
15000-25000/月,三七互娱（上海）科技有限公司,职位描述：岗位职责:1、负责优化公司信息系统整体规划，建立健全公司网络安全体系，确保信息安全；2、负责IT采购资源的规划和管理，保证及时满足业务部门的采购需求；3、监控IT系统日常运行，确保公司网络安全及各网络系统的正常稳定(服务器、防火墙、交换机、程控机、路由器)；4、完善公司各IT系统（邮件系统、监控系统、备份服务、机房数据监控等）；5、负责各部门应用需求管理与解决，及时收集和响应各部门信息化方面的需求，对各部门信息化需求进行评估、分析并提出解决措施，积极推动公司信息化应用水平；6、指导、检查所属下级的各项工作，掌握工作情况和有关数据；任职资格：1、本科及以上学历，计算机类相关专业；2、2年以上网络相关实施和管理经验；3、3年以上大中企业信息化规划与管理工作经验；4、具有优秀的IT基础架构平台的规划设计能力和业务需求分析及整合规划能力；5、精通日常如电话系统、视频会议系统、财务系统的维护以及IT采购相关知识；6、具备良好的职业道德、综合素质、团队合作能力和沟通协调能力；保密意识优秀；职能类别：技术支持/维护经理关键字：IT运维游戏技术举报分享,IT运维组长
10000-14999/月,三七互娱（上海）科技有限公司,职位描述：岗位职责：1、负责挖掘、管理主播，维护主播和用户的关系；2、收集用户信息并根据市场情况调整运营策略或提出产品优化建议，提高直播间用户留存率及付费率；职位要求：1、本科以上学历，具有2年以上主播产品运营经验；2、数据分析能力和逻辑能力强；3、较强的语言表达能力和沟通能力；4、个性开朗、思维活跃、执行力强。职能类别：网站营运经理/主管举报分享,直播平台运营
10000-14999/月,三七互娱（上海）科技有限公司,职位描述：岗位职责：1、进行网站程序设计与开发，参与项目的编程、调试和模块测试工作；2、根据项目需求，能够独立按时完成网站开发任务；3、根据主管部门要求对现有项目进行修改；4、对相关部门提交的BUG进行分析测试，并作出修改。岗位要求：1、1年以上Java网站开发经验；2、熟悉MVC构架模式，精通应用Struts，Spring，Hibernate等框架开发J2EE Web应用；3、熟悉各种Web前端技术，包括XHTML/XML/JSP/CSS/Javascript/jQuery等；4、熟练dreamweaver，eclipse 等开发工具；5、自我管理能力强，有良好的时间意识；6、有较好的沟通交流能力和团队合作精神；7、了解Jboss或Tomcat的基本配置和应用部署，熟悉Web Service优先考虑；8、精通mysql数据库的基本环境配置、具有扎实的数据库方面的开发基础.9、具有丰富的项目开发经验，有较强的错误排查和解决问题的能力；职能类别：多媒体/游戏开发工程师举报分享,java网站工程师
6000-7999/月,三七互娱（上海）科技有限公司,职位描述：岗位职责：1、负责公司培训需求调研，针对不同层级员工培训需求，制定培训计划；2、组织并实施员工培训计划，跟踪培训效果及员工行为转化，保证培训效果；3、策划制定公司企业文化活动方案并组织实施，定期组织各种形式的企业文化主题活动和员工关怀活动；4、策划全年各节日和季节性的员工活动及员工关系会议等，活跃员工气氛，增强员工认同感；5、负责企业内部文化宣传制作，参与创意和设计，编辑企业宣传文案。任职要求：1、本科及以上学历，有亲和力，工作热情积极，沟通能力强，组织协调能力强；2、1年以上培训及员工关系工作经验，互联网/电子商务行业从业经验优先；3、较强的系统思考和规划能力，具有成功的培训项目管理工作的经验；4、熟悉文化活动建设及开展的相关流程并可以独立进行方案整合，有丰富的独自策划、实施员工活动和文化建设项目经验；4、热衷于员工沟通和关系管理，具备和掌握开展相关工作的理论知识和行动方法论；5、有创意思维，对新鲜事物抱有好奇心，对色彩搭配敏感，乐于学习分享。职能类别：人事专员培训专员/助理/培训师关键字：培训员工关系企业文化举报分享,人力资源专员（培训及员工关系）
10000-14999/月,三七互娱（上海）科技有限公司,"职位描述：职位描述：1、从事手游项目的原画设计工作，根据要求进行角色、道具等造型原画设计；2、根据游戏产品可以独立重新包装角色设定及风格，制作游戏壁纸，宣传插画等工作。3、参与游戏ICON,LOGO等设计指导。4、指导及监督视频动画制作。任职要求：1.热爱游戏动漫事业，狂热的游戏爱好者；2.时尚触觉敏锐、对颜色敏感，能把握流行趋势；3.强烈的团队合作意识、协作精神和敬业精神，吃苦耐劳，能承受一定的工作压力；4.熟悉各种游戏美术风格，具有扎实的美术功底和造型设计能力；5.熟练掌握photoshop、Painter等绘画类软件；6. 手绘能力扎实，一年以上网游原画工作经验者优先。职能类别：原画师视觉设计师关键字：原画设计手游原画人物原画icon举报分享",手游原画设计师
6000-7999/月,三七互娱（上海）科技有限公司,职位描述：岗位描述：1、监控数据，实时发现并解决广告投放中出现的问题；2、数据分析，分析市场投放效果并提出有建设性的改进意见；3、优化并不断改进市场广告流程以及后台等工具。任职要求：1、本科及以上学历，学习主动性强；2、对游戏有一定了解，热爱互联网或游戏行业，致力于在游戏行业发展；3、熟练运用word、excel、ppt等office办公软件；4、内敛细心，勤奋踏实，责任心强，具有良好的团队合作精神。5、能承受强大工作压力，适应游戏公司的快节奏。职能类别：网络推广专员关键字：广告数据分析游戏数据分析举报分享,数据分析专员
8000-9999/月,三七互娱（上海）科技有限公司,职位描述：1、 负责媒体广告投放与检查；2、 负责媒介资料数据整理分析与效果跟进；3、 媒体关系的维护，媒介执行、跟进等工作；4、 与客户保持良好的合作关系，了解、协调、反馈客户的相关情况；5、 认真，细致，专注，创新。岗位要求：1、 本科以上学历，广告学、市场营销或相关专业；2、 良好的口头表达能力，较强的沟通应变能力和人际关系协调能力；3、 具备出色、踏实的学习能力，善于观察，灵活并注重细节；4、 能够承受较大的工作压力和较长的工作时间。职能类别：网络推广专员关键字：海外广告投放网络推广举报分享,海外广告投放
20000-24999/月,三七互娱（上海）科技有限公司,职位描述：岗位职责：1、根据项目及市场要求，对设计风格进行定义和把控，对最终设计效果负责；2、负责公司设计团队创意、质量的统筹和监督工作；3、根据游戏推广宣传需求，通过创意和互动营销策略，输出优秀的互动创意表现；4、负责将创意转化成视觉化的设计方案，把控一切从视觉表现到执行制作的创意设计方案的效果和质量 ；5、分享创意方法论和设计经验，推动提高团队的创意设计能力。任职要求：1、3年以上知名广告公司工作经验（具有4A广告公司经验者优先 or 互联网创意相关工作经验者优先）；2、有较强的创作与执行能力，扎实的美术功底和艺术修养，思维活跃，创意层出不穷；3、画面感优秀，能理解广告策略，善于提出独特的创意视角和解读，具有丰富的视觉创意执行经验；4、对广告，影视，动画，新媒体技术应用，游戏经验丰富者优先；5、富有团队协作精神和协调指导能力，富有工作激情，创造力和责任感，乐于表达和分享。职能类别：平面设计总监美术指导关键字：美术指导游戏视觉设计举报分享,美术指导（手游）
25000-29999/月,三七互娱（上海）科技有限公司,职位描述：职位描述：1. 网络游戏和互联网行业市场数据，以及年度市场关联业绩指标建议；2. 互联网行业的政策信息、发展方向和行业动态分析3. 根据公司发展愿景，进行集团战略顶层设计；4. 根据集团战略目标与发展规划，寻找并对潜在的投资项目进行研究和投资分析；并根据前期的尽职调查结果，出具项目可行性分析报告；5. 参与公司投资项目的商务谈判，以及有关商务谈判方案和条件的确定；6. 对投资项目的实施过程和效果进行评价，并提出改进建议；参与对投资结果进行评估，并分析与预期的差异；7. 跟踪集团已投资项目，定期对项目的成本收益进行分析，并提出风险预警与解决方案；任职要求：学历：本科1. 全日制本科及以上学历；2. 至少三年以上投资发展部门工作经验以及管理咨询经验；3. 互联网行业投资分析相关从业经验优先考虑，CPA优先考虑；4. 熟悉投资程序及投资工具，具备良好的项目评估、财务分析、市场分析能力；5. 具有很强的行业分析研究和方案策划能力；6. 具备敏锐的市场洞察力、沟通协调能力以及自我学习和更新能力；7. 逻辑性强，富有团队精神。职能类别：投资/基金项目经理举报分享,投资经理
10000-14999/月,三七互娱（上海）科技有限公司,"职位描述：岗位职责：1、独立拓展和维护移动手游产品的发行渠道，完成商务谈判，维护良好的渠道合作关系；2、对渠道的运营数据进行分析，积极主动与渠道沟通，推进提升渠道产品的运营质量；3、负责定期对行业及同类产品合作运营状况进行调研分析；4、负责监测、搜集、整理和分析各种渠道信息，及时了解和总结渠道反馈。5、协助副总裁处理各项商务事宜。任职要求：1、熟悉互联网、移动互联网行业，至少一年以上互联网渠道商务拓展经验；2、良好的游戏厂商、媒体、渠道等人际关系网络；3、有一定的（安卓、IOS越狱）渠道资源；4、优秀的商务谈判，较强的商业机会敏锐感,逻辑能力和数据分析能力不错;5、有很强的责任心，能独立开展工作、拓展市场，具备团队合作精神，能够承受较强的工作压力；6、优秀的沟通及文字表达能力，具有较强的学习能力，能独立思考问题和解决问题。职能类别：商务经理关键字：游戏产品渠道拓展公关维护举报分享",手游商务经理（渠道）
10000-14999/月,三七互娱（上海）科技有限公司,职位描述：职位描述：1、负责IOS及GOOGLE等游戏渠道商关系的开拓与维护；2、负责监测、搜集、整理和分析各种渠道信息，及时了解和总结渠道反馈，并提出优化解决方案；3、负责与合作伙伴确定推广方案，结合运营需求进行渠道推广；4、负责制定手机游戏产品营销计划，并推动计划顺利实施；5、负责商务合作，并与合作伙伴保持良好的合作关系。任职要求：1、本科及以上学历，英语等相关专业；2、热爱手机游戏，对游戏行业有强烈兴趣；3、有良好的沟通协调、商务谈判能力，公关能力强，能够承受较强的工作压力；4、有较强的责任心和使命感，能独立开展工作、拓展市场，具备团队合作精神；5、有外企工作经历，对IOS及GOOGLE渠道推广经验者优先。职能类别：网络推广专员关键字：ios渠道关系APP商务推广渠道商务举报分享,手游商务经理
